{
	"contractVersion": "training-1",
	"dataClass": "SYNTHETIC_ONLY",
	"fixtureId": "CASE-SYN-003",
	"input": {
		"locale": "en-CA",
		"jurisdiction": "ON",
		"vehicleClass": "UNKNOWN",
		"plan": "TRAINING_BASIC"
	},
	"rulebook": {
		"id": "RULEBOOK-SYN-ON",
		"version": "training-1",
		"authority": "WORKSHOP_AUTHORS_ONLY",
		"notice": {
			"en-CA": "Training simulation only. Not an insurance quote. No delivery.",
			"fr-CA": "Simulation de formation uniquement. Ceci n'est pas une soumission d'assurance. Aucun envoi."
		},
		"currency": "CAD",
		"period": "TRAINING_YEAR",
		"baseCents": { "COMPACT": 80000, "SEDAN": 90000 },
		"planAddOnCents": { "TRAINING_BASIC": 0, "TRAINING_EXTENDED": 20000 },
		"rules": [
			{ "id": "RULE-SYN-BASE", "kind": "BASE_LOOKUP" },
			{ "id": "RULE-SYN-PLAN", "kind": "PLAN_LOOKUP" },
			{ "id": "RULE-SYN-REVIEW", "kind": "EMPLOYEE_GATE" }
		]
	},
	"expectedCalculation": {
		"status": "UNSUPPORTED",
		"amountCents": null,
		"currency": "CAD",
		"period": "TRAINING_YEAR",
		"ruleIds": [],
		"issues": ["UNSUPPORTED_INPUT"]
	},
	"workflow": {
		"caseId": "CASE-SYN-003",
		"draftId": "DRAFT-SYN-003",
		"draftRevision": 1,
		"recordVersion": 1,
		"state": "UNSUPPORTED",
		"approvedRevision": null,
		"previewRevision": null,
		"audit": [
			{
				"sequence": 1,
				"commandId": "CMD-CREATE-003",
				"action": "CREATE_DRAFT",
				"fromState": "INCOMPLETE",
				"toState": "UNSUPPORTED",
				"draftRevision": 1,
				"actorId": "MOCK-CONTROLLER-001",
				"actorRole": "APPLICATION_CONTROLLER",
				"at": "2026-01-03T09:00:00Z"
			}
		]
	},
	"nextCommand": {
		"commandId": "CMD-REVIEW-003",
		"caseId": "CASE-SYN-003",
		"draftRevision": 1,
		"expectedRecordVersion": 1,
		"action": "APPROVE",
		"reasonCode": "REVIEWED"
	},
	"expectedDisplay": {
		"en-CA": "This vehicle class is not supported by the training rulebook",
		"fr-CA": "Cette cat\u00e9gorie de v\u00e9hicule n'est pas prise en charge par le bar\u00e8me de formation"
	}
}
