{
	"contractVersion": "training-1",
	"dataClass": "SYNTHETIC_ONLY",
	"fixtureId": "CASE-SYN-005",
	"input": {
		"locale": "fr-CA",
		"jurisdiction": "ON",
		"vehicleClass": "COMPACT",
		"plan": null
	},
	"rulebook": {
		"id": "RULEBOOK-SYN-ON",
		"version": "training-1",
		"authority": "WORKSHOP_AUTHORS_ONLY",
		"notice": {
			"en-CA": "Training simulation only. Not an insurance quote. No delivery.",
			"fr-CA": "Simulation de formation uniquement. Ceci n'est pas une soumission d'assurance. Aucun envoi."
		},
		"currency": "CAD",
		"period": "TRAINING_YEAR",
		"baseCents": { "COMPACT": 80000, "SEDAN": 90000 },
		"planAddOnCents": { "TRAINING_BASIC": 0, "TRAINING_EXTENDED": 20000 },
		"rules": [
			{ "id": "RULE-SYN-BASE", "kind": "BASE_LOOKUP" },
			{ "id": "RULE-SYN-PLAN", "kind": "PLAN_LOOKUP" },
			{ "id": "RULE-SYN-REVIEW", "kind": "EMPLOYEE_GATE" }
		]
	},
	"expectedCalculation": {
		"status": "INCOMPLETE",
		"amountCents": null,
		"currency": "CAD",
		"period": "TRAINING_YEAR",
		"ruleIds": [],
		"issues": ["MISSING_PLAN"]
	},
	"workflow": {
		"caseId": "CASE-SYN-005",
		"draftId": "DRAFT-SYN-005",
		"draftRevision": 1,
		"recordVersion": 1,
		"state": "INCOMPLETE",
		"approvedRevision": null,
		"previewRevision": null,
		"audit": [
			{
				"sequence": 1,
				"commandId": "CMD-CREATE-005",
				"action": "CREATE_DRAFT",
				"fromState": "INCOMPLETE",
				"toState": "INCOMPLETE",
				"draftRevision": 1,
				"actorId": "MOCK-CONTROLLER-001",
				"actorRole": "APPLICATION_CONTROLLER",
				"at": "2026-01-05T09:00:00Z"
			}
		]
	},
	"nextCommand": {
		"commandId": "CMD-REVIEW-005",
		"caseId": "CASE-SYN-005",
		"draftRevision": 1,
		"expectedRecordVersion": 1,
		"action": "APPROVE",
		"reasonCode": "REVIEWED"
	},
	"expectedDisplay": {
		"en-CA": "Missing plan selection",
		"fr-CA": "S\u00e9lection de r\u00e9gime manquante"
	}
}
